" Bill Gates "," Software is a great combination between artistry and engineering. "
" Bill Gates "," The common thread for everything I do is this idea of a Web-services architecture. What does that mean? It means taking components of software and systems and having them be self-describing, so that you can aim them, ask them what their capabilities are, and communicate with them using a standard protocol. "
" Bill Gates "," In almost every job now, people use software and work with information to enable their organisation to operate more effectively. "
" Rebecca MacKinnon "," While sanctions against Iran and Syria are intended to constrain those countries' governments, they have had the unfortunate side effect of constraining activists' access to free online software and services used widely across the Middle East, including browsers, online chat applications, and online storage services. "
" Brian Eno "," Software options proliferate extremely easily - too easily, in fact - because too many options create tools that can't ever be used intuitively. Intuitive actions confine the detail work to a dedicated part of the brain, leaving the rest of one's mind free to respond with attention and sensitivity to the changing texture of the moment. "
" Peter Diamandis "," Paul Allen with Microsoft revolutionized the software industry. "
" Craig Venter "," In a biological system, the software builds its own hardware, but design is critical, and if you start with digital information, it has to be really accurate. "
" Alex Berenson "," Automated call centers are only the most obvious way speech recognition will be used. The software is now becoming sophisticated enough to identify speakers through 'voiceprints,' akin to fingerprints, eventually reducing the need for personal identification numbers. "
" Mark Cuban "," For food service industry and retail, I'm for the minimum wage being increased to at least $12. Not for manufacturing. Software and robotics are going to revolutionize manufacturing in the next 10 years. In the meantime, we have to compete with overseas manufacturing. "
" Mark Cuban "," Traditional TV will have to innovate their TV delivery software in new ways beyond just offering their content in an app in order to change the viewing erosion of TV. "
" Barton Gellman "," Given the volume of PC sales and the way McAfee runs its operation, I imagine there must be thousands of phantom subscribers - folks who signed up once upon a time and left the software behind two or three computers ago. "
" Barton Gellman "," I do read licenses, and they aggravate me, but a computer isn't much good without software. When I need a product, I hold my nose and click 'agree.' "
" Barton Gellman "," Ghostery lets you spy on the spies in your computer. For each web page you visit, this extension uncloaks some - but not all - of the invisible tracking software that is working behind the scenes. "
" Kevin Mitnick "," Back in my day, I would probe by hand. Now you can get commercial software that does the job for you. "
" Douglas Rushkoff "," For Google, the problem with being a free, abundant, and rather infinite set of services is that it's hard to create much of a stir about anything. There are so many major software service options under the 'more' menu on the Gmail page that they've had to go and add a final item called 'even more.' "
" Douglas Rushkoff "," Technology has moved away from sharing and toward ownership. This suits software and hardware companies just fine: They create new, bloated programs that require more disk space and processing power. We buy bigger, faster computers, which then require more complex operating systems, and so on. "
" Naveen Jain "," I have absolutely no idea about space exploration. I'm a software guy. But because I'm a non-expert, I've been able to bring the software concept of modularity into the space sector, which was never done before. "
" T. J. Miller "," I know about the tech industry in that I follow what apps are hot and software development. I know my way around different browsers. I know how to restart a computer. "
" Satya Nadella "," I want to see us remain convinced that software matters in the future. "
" Vint Cerf "," Writing software is a very intense, very personal thing. You have to have time to work your way through it, to understand it. Then debug it. "
" Vint Cerf "," For systems in which you already have a lot of hardware and software, change is difficult. That's why apps are so popular. "
" George Packer "," Everything seems set up for success in digital journalism - money, eyeballs, software, brands. "
" Matt Mullenweg "," For me, it always comes back to the blogger, the author, the designer, the developer. You build software for that core individual person, and then smart organisations adopt it and dumb organisations die. "
" Evgeny Morozov "," Free open-source software, by its nature, is unlikely to feature secret back doors that lead directly to Langley, Va. "
" Walt Mossberg "," Whether you are a consumer, a hardware maker, a software developer or a provider of cool new services, it's hard to make a move in the American cellphone world without the permission of the companies that own the pipes. "
" Walt Mossberg "," Our lives and our culture have been significantly changed and improved by hardware, software, and services developed by immigrants. "
" Walt Mossberg "," Lauren Goode and I have agreed that the next version of the Mac software - all of them are named after places in California - should be named either Bridgeport or Warwick. "
" Walt Mossberg "," Apple's advantage is that it designs and builds software together, so if the software isn't excellent, it does the superlative hardware a disservice. "
" Walt Mossberg "," Companies often visit my office, or invite me to theirs, to brief me on new products, Web sites, or software before they are released - usually a few weeks or days ahead of time. I don't review most of these products. "
" Walt Mossberg "," Though the S8, like all premium Samsung phones, runs Android with the basic Google suite of apps, Samsung keeps trying to duplicate Android functions with its own software. It wants to be a software platform like its rival Apple, but it uses someone else's operating system and core apps. Awkward. "
" Walt Mossberg "," As for the device we now call a TV or a cable box, I want it to be fast with a clean interface and seamlessly upgradeable to the latest software. I want it to be the primary source of all TV, not an ancillary device. "
" Flume "," Making sounds that literally no one has ever heard before because the software and the technology's never been there, and pairing that with great songwriting, then that's what's exciting for me. That's what I wanna do. "
" Gene Luen Yang "," I majored in Computer Science at U.C. Berkeley and worked as a software developer for a couple of years. Then I taught high school computer science for over a decade and a half in Oakland, California. "
" Jason Fried "," When we launched the first version of Basecamp in 2004, we decided to build software for small companies just like us. "
" Jason Fried "," We've never much liked the idea of charging a participation tax, a phrase we coined to represent what it feels like when a software company charges you more money for each additional user. Participation taxes discourage usage across a company. "
" Sam Altman "," The way to really scale a venture firm is with software. "
" Sam Altman "," All the reasons that have made software so successful are beginning to happen with hardware. So much can be done so quickly, prototyped so rapidly, and the costs are so low. "
" Mitch Kapor "," I was trying to figure out what to do next, I'd been accumulating ideas for productivity tools - software people could use every day, particularly to help organize their lives. "
" Mitch Kapor "," It became clear to me by 1984 that Microsoft was likely going to be the big winner in the PC software apps and operating system category, partly because of the dynamics of owning and controlling the operating system: that gave you enormous power, and I came to see Bill Gates was fierce competitor. "
" Marvin Ammori "," In software and many other online markets, even dominant firms face potential threats because of the low costs for competitors to enter those markets. Threats more easily emerge because of better or newer technologies leapfrogging older ones. "
" Kevin O'Leary "," Software is becoming no different than a videotape or a record album or a paperback book, and not all of us are ready for that change. "
" Kevin O'Leary "," For whatever reason somebody can be convinced to buy a PC, it opens up a whole new market for all of us in the software business. "
" Mary Roach "," It is interesting to come across people who feel that a ghost communicating via a spell-checker is less far-fetched than a software glitch. "
" Steve Jurvetson "," Machine learning allows us to build software solutions that exceed human understanding and shows us how AI can innervate every industry. "
" John Battelle "," We speak of 'software eating the world,' 'the Internet of Things,' and we massify 'data' by declaring it 'Big.' But these concepts remain for the most part abstract. It's hard for many of us to grasp the impact of digital technology on the 'real world' of things like rocks, homes, cars, and trees. We lack a metaphor that hits home. "
" Ryan Holmes "," No surprise that, as companies have adopted social media en masse, demand for software and applications to manage and monitor social use has exploded. "
" Linus Torvalds "," Software patents, in particular, are very ripe for abuse. The whole system encourages big corporations getting thousands and thousands of patents. Individuals almost never get them. "
" Nick Woodman "," GoPro's capture devices and Kolor's software will combine to deliver exciting and highly accessible solutions for capturing, creating, and sharing spherical content. "
" Jon Oringer "," As I started college, I started to build software products that I could sell to people over the Web. "
" Jon Oringer "," I started Shutterstock out of my own need. I'd previously created a few software companies, and each time, I struggled to find affordable images to use on my websites. "
" Alex Pareene "," Cable boxes are, almost without exception, awful. They're under-powered computers running very badly designed software. Their channel guides are slow, poorly laid out, and usually riddled with ads. "
" Astro Teller "," Google is already overflowing with incredibly creative bright groups already working on lots of the software problems of the world. "
" Astro Teller "," If software's the only thing in your bag of tools, I'm not going to give you great odds. "
" Suzan DelBene "," The i730 combines the familiarity of Windows Mobile software with the innovative design of Samsung that will be a popular choice for mobile professionals. "
" Suzan DelBene "," We are very pleased with Vodafone's decision to adopt Windows Mobile as a preferred software platform for its mobile business. Together, we will deliver services which we expect will help Vodafone achieve cost-efficiencies while delivering new propositions to its customers, thus making Windows Mobile an even more compelling platform. "
" Howard Rheingold "," Open source production has shown us that world-class software, like Linux and Mozilla, can be created with neither the bureaucratic structure of the firm nor the incentives of the marketplace as we've known them. "
" Jidenna "," One day, my mum bought me this music production software for my computer, and I started making beats... I realised it was more like production than a video game, but it was a video game when I was playing it. That's how I got into music production. "
" N. R. Narayana Murthy "," I think India has several advantages in the knowledge sector, in the software sector. "
" N. R. Narayana Murthy "," I think there are opportunities outside India as well as in India. In fact, some of the largest projects that most Indian software companies are doing are in India. "
" Jack Dangermond "," We shifted our philosophy from being a computer mapping group that would support planners to the idea of building actual software that would be well engineered. Because at that time, our software was not well-engineered at all; it was basically built with project funding and for project work, largely by ourselves. "
" Jack Dangermond "," GIS started on mainframe computers; we could get one map every five to 10 hours, and if we made a mistake, it could take longer. In the early '90s, when people started buying PCs, we migrated to desktop software. "
" Fred Wilson "," Yahoo is free, it's fast and it's Web-centric. AOL is slow, it costs money and requires proprietary software. "
" John Carmack "," To the game code, the world is still just a tile map, but for rendering, each map was exported as a general-purpose 3D model, and the artists could then go through it and spend the polygons any way they liked, without the limits of line-of-constant-z software rasterization that we lived with on the mobile phones. "
" John Carmack "," When people heard id Software's being acquired, everybody just assumed it would be Activision or EA. Why would we even consider going with a publisher that wasn't of that same size? "
" Jimmy Wales "," One of the ways that Microsoft beat Apple way back in the day was that they were a lot more open; today, in the world I come from, the free software and open-source world, Microsoft is not generally viewed as open; they're viewed as proprietary. "
" Brendan Iribe "," Oculus is actually more of a software company than it is a hardware company. "
" Julia Glass "," In my fairly disorganized life, yellow stickies are too easily lost, and as for software, I try to avoid using my computer as much more than a typewriter and a post office. I rely on my lifelong habit of daydreaming to spin my stories. "
" Jaron Lanier "," Human beings either function as individuals or as members of a pack. There's a switch inside us, deep in our spirit, that you can turn one way or the other. It's almost always the case that our worst behaviour comes out when we're switched to the mob setting. The problem with a lot of software designs is that they switch us to that setting. "
" Jaron Lanier "," The basic problem is that web 2.0 tools are not supportive of democracy by design. They are tools designed to gather spy-agency-like data in a seductive way, first and foremost, but as a side effect they tend to provide software support for mob-like phenomena. "
" Mitchell Baker "," So many commercial orgs have software where you can come and modify it, but they still control everything. And what's controlled is very clearly what's good for their business, or if they're more progressive, their view of what's good for the Internet. "
" Richard Stallman "," Proprietary software keeps users divided and helpless. Divided because each user is forbidden to redistribute it to others, and helpless because the users can't change it since they don't have the source code. They can't study what it really does. So the proprietary program is a system of unjust power. "
" Jonathan Zittrain "," With the rise of software patents, engineers coding new stuff - whether within a large software company or as kids writing smartphone apps - are exposed to a claim that somewhere a prior patent is being infringed. "
" Roger McGuinn "," Now, you can just get a laptop, get some software, put a microphone on it and make a record. You have to know how to do it. It does help if you've had 35 or 40 years of experience in the studio. But, it still levels the playing field so artists can record their own stuff. "
" Buffy Sainte-Marie "," Digital art software has empowered both the painterly side of photographers, and the photographer side of painters. "
" Niklas Zennstrom "," Then people started using it more and more and it became the most downloaded software on the internet. "
" Keith Barry "," Some computers have security software that make it impossible to hack into, and it's the same with brains - some malfunction, and some, you can't hack into them at all. "
" Eric Maskin "," Specifically, in the software industry, progress is highly sequential: progress is typically made through a large number of small steps, each building on the previous ones. "
" Daniel Wu "," For Mandarin scripts, there's software now where you can just insert the Chinese script, and it comes out all in pinyin. "
" Harold Ford, Jr. "," Lawmakers misrepresent the facts when they call the manufacturing deduction known as Section 199 - passed by Congress in 2004 to spur domestic job growth - a 'subsidy' for oil and gas firms. The truth is that all U.S. manufacturers, from software producers to filmmakers and coffee roasters, are eligible for this deduction. "
" John Hughes "," A geek is a guy who has everything going for him but he's just too young. He's got the software but he doesn't have the hardware yet. "
" Larry Ellison "," We have most of the software industry running Autonomy. "
" John Sulston "," I believe our basic information, our 'software', should be free and open for everyone to play with, to compete with, to try and make products from. I do not believe it should be under the control of one person. "
" Xavier Niel "," The most sought-after candidates in the world today by companies like mine are people who make computer software - there's a shortage of talent. "
" Louis Navellier "," I simply can't buy as much of some stocks such as Detection Systems or United Education & Software as I'd like because there just aren't all that many shares available. "
" Henry Samueli "," Anytime you put a challenge out there, people come up with a creative solution on the software side. "
" Henry Samueli "," We need to get smarter about hardware and software innovation in order to get the most value from the emerging Internet of Things. "
" Larry Wall "," I think software patents are a bad idea. Many patents are given for trivial inventions. "
" Larry Wall "," I want people to use Perl. I want to be a positive ingredient of the world and make my American history. So, whatever it takes to give away my software and get it used, that's great. "
" Clive Thompson "," Software is now so complex - requiring so many gazillions of tiny files all over your computer - that most consumers don't want to bother to know what's really going on. "
" Clive Thompson "," If you, or any public-spirited programmer, wanted to figure out what the software on your machine is really doing, tough luck. It's illegal to reverse engineer the source code of commercial software to find out how it works. "
" Steve Case "," One of the problems with computers, particularly for the older people, is they were befuddled by them, and the computers have gotten better. They have gotten easier to use. They have gotten less expensive. The software interfaces have made things a lot more accessible. "
" Pierre Omidyar "," In 1991, I co-founded my first start-up, Ink Development, which made software for an early tablet computer. "
" Mike Krieger "," Software is like gardening - one day I'll go behind the shed and clean up. But if nobody ever goes there, does it matter a lot? "
" Palmer Luckey "," Games take years to make, and it's important that when we launch, it can't just be a great launch catalog and then a desert for a really long time. To be honest, for a lot of developers, they'd rather not be competing at launch with all this other software. "
" Palmer Luckey "," Virtual reality is a tough sell for a software developer. They have to convince investors that not only are they going to build a good game, which is what they normally have to do, they have to convince them that it's going to be a good game and that virtual reality will be successful. "
" Bre Pettis "," My parents had a software company making children's software for the Apple II+, Commodore 64 and Acorn computers. They hired these teenagers to program the software, and these guys were true hackers, trying to get more colors and sound and animation out of those computers. "
" Phil Schiller "," From the beginning, the Mac has been about Apple taking responsibility for the whole thing: hardware, software, how applications can work, and, increasingly, Internet services. "
" Ren Ng "," If you think about all the light that enters - that enters the lens of a camera, that's much more than a photo. The light field is all the higher-dimensional information that's lost in a regular photo. When we record all this information, that provides us the opportunity in software after the fact. "
" Mike Shinoda "," The thing is, there are so many different ways to make music these days with virtual instruments, software applications, physical instruments, and computer programs. "
" Mike McCue "," In high school, I started my first company, called M Cubed Software. We named it that because it was me and two other guys named Mike. "
" Dweezil Zappa "," Modern records are all made with virtually identical gear, software plug-ins and everything. Everybody wants everything to sound like the last thing that was popular because they're chasing their tails. "
" Brendan I. Koerner "," The hazards posed by Near-Earth Asteroids are assessed by Sentry, a computer system developed by the Near-Earth Objects Group at NASA's Jet Propulsion Laboratory in Pasadena, Calif. The software factors together a cosmic rock's coordinates, distance, velocity, and gravitational influences to calculate its trajectory. "
" Todd Park "," When I was 24, I co-founded a company called Athenahealth which built the first Web-based software and back-office service suite for doctors' offices. "
" Jim Barksdale "," We can collaborate with a Netscape employee or partner who's halfway around the world. We can distribute information and software to customers and shareholders, and get their feedback. "
" Jim Barksdale "," We can provide beta software to our developers in advance of the general public. We can easily link up with external partners, customers, and suppliers. "
" Jim Barksdale "," I think we're proving ourselves as we go along. The past several months our strategy has been evolutionary - making maximum advantage of our client browser, as well as our enterprise software for people who want to build Web sites. "
" Jim Barksdale "," I don't believe in government regulation of the software industry. "
" Dennis Crowley "," I feel lucky because earlier in my career, I found what I liked to do; it's build software that you see your friends using on the street, and they like it. "
" Allison Schroeder "," I interned at NASA for five years, and I grew up in Cape Canaveral, and my grandfather was an engineer on the Mercury capsule, and my grandmother was a software engineer. I literally grew up playing on the Mercury capsule prototypes. "
" Hasso Plattner "," The software industry has to become better in componentization. That's a clear focus for most of the software companies. How components look, how they are maintained, the ability to maintain them separately. "
" Lawrence Lessig "," While the creative works from the 16th century can still be accessed and used by others, the data in some software programs from the 1990s is already inaccessible. "
" Eric Whitacre "," Many composers use software to write music - programs like Finale or Sibelius. There are also recording programs. I should say I'm still very old-fashioned, I still use pencil and paper. But almost every composer I know does it the 'new way.' "
" Safra A. Catz "," My best decision was to choose to go to Wall Street over law. I learned a lot and focused on the expanding software industry at a time when the independent software industry was just beginning. "
" Safra A. Catz "," In 1986, Microsoft and Oracle went public within a day of each other, and I recall telling one of my colleagues that the software business will become big. So I started working with software companies in the mid-'80s and never turned back. "
" Adi Godrej "," We have a company, Geometric Software, which is into engineering services software. We have a company called Nature's Basket, which is into gourmet retailing. Both are specialized companies. "
" Nivin Pauly "," I was working as a software engineer in Infosys. I quit because I lost interest in it. I had a group of friends who wanted to make it big in films, and that's when the audition for 'Malarvady Arts Club' happened. I got selected, and it opened the doors to my dream world. "
" Brian L. Roberts "," We took the brains out of the set-top box and put it in the cloud. Having our software in the cloud gives consumers the ability to click their remote control and navigate through thousands of choices in a simple and elegant way. That's magic. "
" Calvin Harris "," Right at the start, when I was about 13 or 14, I only had an Amiga 500 Plus running a bit of tracker software called OctaMED. My brother was big into his computers, and when he moved up to a proper PC, I took charge of the Amiga. "
" Kent Beck "," I think it's a combination of technical and social factors that leads to all the defects in deployed software. "
" Kent Beck "," There's a huge latent market for software development that's just flat-out honest. "
" Kent Beck "," A rational model of software is to design it quickly - the economic pressure to improvise presents an interesting challenge. "
" Kent Beck "," People are looking for software development that actually does something useful... People are looking for partners who deliver when promised, and at a reasonable and transparent price. I believe that the days of being able to value price software are numbered. "
