" Bill Gates "," Software is a great combination between artistry and engineering. "
" Katie Hafner "," Using the HTTP protocol, computer scientists around the world began making the Internet easier to navigate by inventing point-and-click browsers. One browser in particular, called Mosaic, created in 1993 at the University of Illinois, would help popularize the Web, and therefore the Net, as no software tool had yet done. "
" Jay Chiat "," Our technology is very scalable. Our software can accommodate enormous numbers of clients. It's a marvelous opportunity. We'll keep developing products. "
" Miguel de Icaza "," Every piece of software written today is likely going to infringe on someone else's patent. "
" Miguel de Icaza "," The software patent problem is not limited to Mono. Software patents affect everyone writing software today. "
" Miguel de Icaza "," Our strategy in dealing with patents in Mono is the same strategy that any other software developer would take. In the event of a patent claim, we will try to find prior art to the claim of the patent. "
" Wietse Venema "," In a previous life I wrote the software that controlled my physics experiments. That software had to deal with all kinds of possible failures in equipment. That is probably where I learned to rely on multiple safety nets inside and around my systems. "
" Wietse Venema "," Qmail out of the box works fine, so people will want to use it regardless of licensing restrictions, even when the software does not ship with their system software. "
" Wietse Venema "," Like all software, Qmail can survive only when it keeps up with changing requirements. "
" John Maeda "," I don't like creating software anymore. It's too exact. It's like karate; there's no room for error. "
" Jan Chipchase "," Facial recognition software is already quite accurate in measuring unchanging and unique ratios between facial features that identify you as you. It's like a fingerprint. "
" Michael J. Saylor "," I basically got an education in software on DuPont's money because they were too stubborn to admit that a recession was coming. "
" Michael J. Saylor "," I think my software is going to become so ubiquitous, so essential, that if it stops working, there will be riots. "
" Michael J. Saylor "," The industries that fall first are the industries that either produce electromechanical items that are now inferior to their software substitutes, or the industries that produce a mechanically created service that's now inferior. "
" Michael J. Saylor "," Companies that make keys, credit card companies, any company in the service business - anything to do with a consumer is probably a software company. "
" Niklaus Wirth "," Indeed, the woes of Software Engineering are not due to lack of tools, or proper management, but largely due to lack of sufficient technical competence. "
" Niklaus Wirth "," Yet, I am convinced that there is a need for high quality software, and the time will come when it will be recognized that it is worth investing effort in its development and in using a careful, structured approach based on safe, structured languages. "
" Trip Hawkins "," From day one our next generation system will run all our exsisting software - so that gives us a head start. "
" Jaan Tallinn "," Once computers can program, they basically take over technological progress because already, today, the majority of technological progress is run by software, by programming. "
" Shawn Fanning "," Well, user feedback was excellent. Even when the software didn't work at all, there were few people who were avid users, and there were people who were just sending excellent feedback and excellent ideas. "
" Ryan Bethencourt "," Simple genome engineering of bacteria and yeast is just the beginning of the rise of the true biohackers. This is a community of several thousand people, with skill sets ranging from self-taught software hackers to biology postdocs who are impatient with the structure of traditional institutional lab work. "
" Justin Rosenstein "," Historically, software for business was seen as unsexy because the products were seen as so poor - they provided such a poor user experience. "
" Dave Sitek "," Pop belonged to more musical people in earlier times, but we've sort of gotten away from that. Now it's software people. I kind of feel like reclaiming it is in order. "
" Eric S. Raymond "," If Unix could present the same face, the same capabilities, on machines of many different types, it could serve as a common software environment for all of them. "
" Brian Behlendorf "," Corporations have been killing the risk-taking and exploration that makes software great. They have tried to rip the soul out of development. "
" Brian Behlendorf "," Software as an asset isn't stable over time; it needs to be maintained. "
" Jim Parrack "," My father is a retired army captain and banking software salesman, and my mother is an English teacher. "
" Daniel Suarez "," I wrote a piece of software in 1998 that created fictional weather. "
" Roberta Williams "," Computers have become more friendly, understandable, and lots of years and thought have been put into developing software to convince people that they want and need a computer. "
" Roy Romer "," Interactive computers and software will, I think, provide a less costly method of doing some kinds of inquiry, in knowledge acquisition and even reasoning and interaction. "
" Roy Romer "," You know, IBM was almost knocked out of the box by other types of computer software and manufacturing. "
" Kevin Lynch "," Just like the Internet has transformed the media industry or the e-commerce industry, the software industry is also being affected dramatically by the Internet. "
" Brian Kernighan "," Even though most people won't be directly involved with programming, everyone is affected by computers, so an educated person should have a good understanding of how computer hardware, software, and networks operate. "
" KSI "," When I was, like, 16 or 17, I was just finding out about this YouTube thing. Then I saved a bit and asked my parents for some help to get the recording software and equipment. "
" Renee James "," We're about getting all the people who want to compete with Samsung to be able to build devices. So we're kind of down at the guts level saying, 'Hey, we can give you the hardware, the sensor platform, the software you need to go build your own one.' "
" Jon Evans "," I'm a victim of Developaralysis: the crippling sense that the software industry is evolving so fast that no one person can possibly keep up. "
" Jon Evans "," As hardware doubles its density every 18-24 months, courtesy of Moore's Law, and as software eats the world, technology will replace a broad swathe of jobs outright - from burger-flippers to diagnosticians - and atomize many others from full-time positions into gigs performed by many fungible workers. Tech, in short, will eat jobs. "
" Jon Evans "," I've been a software engineer, a novelist, a journalist, and a manager - and managing developers is easily the trickiest thing I've ever done. "
" Jon Evans "," Governments are scared of software. "
" Jon Johansen "," I took a job in the U.S. because I wanted to work on products that would get into end users' hands. In Norway, most of the jobs are in server software, niche stuff. "
" Jane Jensen "," Before I became a game designer, I was a software engineer. "
" Seth Gordon "," I discovered shooting and filmmaking around the time all of the software became affordable to anyone with a PC. "
" Jairam Ramesh "," WTO is not the forum for labour standards. Next, the U.S. will argue the time zone difference is an unfair competitive advantage enjoyed by India that enables our software engineers to work while the Americans sleep. "
" Jim Allchin "," There is no neat distinction between operating system software and the software that runs on top of it. "
" Nadia Ali "," I write my songs many times to chord progressions on a piano. Unfortunately, I can't keep playing the piano, so I just record it into the software. "
" Robert Love "," Compounding the cost, most mapping software is processor-intense. "
" Suraj Sharma "," My ma is an economist. My dad is a software engineer. "
" Brenda Laurel "," I don't understand computers. I've been unable to construct a working mental model of how they do what they do. I can break software by looking at it. I can blow anything up. Without trying. It's sort of like being a dowser. And this extreme elaborate clumsiness on my part is actually something people will pay me for. It's quite wonderful. "
" Peter Fenton "," In open-source in general, the power lies in connecting the author of the software directly to users, eliminating the middleman. "
" Rob Pike "," The process of software development doesn't feel any better than it did a generation ago. "
" Osman Rashid "," As things go digital, the notion of new editions will go away. A publisher can add video and assessment content at scale, make the change in 30 seconds and it's just a software update. "
" David Pogue "," I'm always surprised at how many people seem to like reading about what hardware and software I use. "
" Pat Cadigan "," I took this 'how to build computers' course basically because I'm sick and tired of getting ripped off by cheesy computer companies. Software baffles me. I like hardware. I used to change my own oil, and now I want to build my own computer so I can have what I want. "
" Dan Kaminsky "," The reality of most software development is that the consequences of failure are simply nonexistent. "
" Dan Kaminsky "," Software tends not to kill people, and so we accept incredibly fast innovation loops because the consequences are tolerable and the results are astonishing. "
" Keith Rothfus "," I went to see the stock exchange when I was 18 years old. I'm not a Wall Street lawyer, I'm a Stanwix Street lawyer. Stanwix Street is a street in downtown Pittsburgh. One of the clients is Mellon Bank, which merged with the Bank of New York Mellon a number of years ago. And I have for years have done software licensing for Mellon. "
" Keith Rothfus "," I'm a transactional lawyer; I negotiate all types of things, but with a particular focus in software licenses. "
" Wang Leehom "," I write and do all my arrangements on my Mac. And um, I use Logic Pro, which is a great software program. "
" Golan Levin "," I think there's a great homogenizing force that software imposes on people and limits the way they think about what's possible on the computer. Of course, it's also a great liberating force that makes possible, you know, publishing and so forth, and standards, and so on. "
" David Wroblewski "," I set writing aside when I went into theater, and then I set theater aside and subsequently had about a 25-year career in software development. Which, by the way, is a very creative field. I equate it more to kinetic sculpture than anything else, as an activity. "
" David Wroblewski "," When you're making something big, whether it's long-form fiction or a big piece of software, whatever that is, you're having a very intimate and extended conversation with the work materials themselves. "
" Tony Hoare "," There are two methods in software design. One is to make the program so simple, there are obviously no errors. The other is to make it so complicated, there are no obvious errors. "
